<?xml version="1.0"?>

<reservations xmlns:xsi="http://www.w3.org/2001/XMLSchema-instance" xsi:noNamespaceSchemaLocation="reservations.xsd">

	<issued_reservations>5</issued_reservations>
	
	<individual_reservation>
		<reservation_number>1</reservation_number>
		<from>1</from>
		<to>1</to>
		<train>1</train>
		<car>1</car>
		<seat>1</seat>
	</individual_reservation>

	<individual_reservation>
		<reservation_number>3</reservation_number>
		<from>1</from>
		<to>1</to>
		<train>1</train>
		<car>1</car>
		<seat>2</seat>
	</individual_reservation>

	<group_reservation>
		<reservation_number>2</reservation_number>
		<from>1</from>
		<to>1</to>
		<train>1</train>
		<car>1</car>
		<count>2</count>
	</group_reservation>

	<group_reservation>
		<reservation_number>4</reservation_number>
		<from>1</from>
		<to>1</to>
		<train>1</train>
		<car>1</car>
		<count>2</count>
	</group_reservation>

</reservations>
